{
  "version": 1,
  "name": "seam-demo",
  "seed": 20261028,
  "arms": [
    "fan-ramp",
    "thin"
  ],
  "min_decided": 2,
  "rules": {
    "preferred": [
      2,
      3
    ],
    "not_worse": [
      1,
      3
    ]
  },
  "group": [
    {
      "name": "sky",
      "images": [
        "sky-01",
        "sky-02"
      ]
    },
    {
      "name": "structured",
      "images": [
        "structured-01",
        "structured-02"
      ]
    }
  ]
}
